No.     Time           Source                Destination           Protocol Length Info
      1 0.000000000    192.168.222.128       10.220.104.180        TCP      74     44180 > EtherNet-IP-2 [SYN] Seq=0 Win=14600 Len=0 MSS=1460 SACK_PERM=1 TSval=95848 TSecr=0 WS=16

Frame 1: 74 bytes on wire (592 bits), 74 bytes captured (592 bits) on interface 0
    Interface id: 0
    WTAP_ENCAP: 1
    Arrival Time: May  7, 2013 11:27:17.492381000 MST
    [Time shift for this packet: 0.000000000 seconds]
    Epoch Time: 1367951237.492381000 seconds
    [Time delta from previous captured frame: 0.000000000 seconds]
    [Time delta from previous displayed frame: 0.000000000 seconds]
    [Time since reference or first frame: 0.000000000 seconds]
    Frame Number: 1
    Frame Length: 74 bytes (592 bits)
    Capture Length: 74 bytes (592 bits)
    [Frame is marked: False]
    [Frame is ignored: False]
    [Protocols in frame: eth:ip:tcp]
    [Coloring Rule Name: TCP SYN/FIN]
    [Coloring Rule String: tcp.flags & 0x02 || tcp.flags.fin == 1]
Ethernet II, Src: Vmware_7a:e2:23 (00:0c:29:7a:e2:23), Dst: Vmware_fb:35:e0 (00:50:56:fb:35:e0)
    Destination: Vmware_fb:35:e0 (00:50:56:fb:35:e0)
        Address: Vmware_fb:35:e0 (00:50:56:fb:35:e0)
        .... ..0. .... .... .... .... = LG bit: Globally unique address (factory default)
        .... ...0 .... .... .... .... = IG bit: Individual address (unicast)
    Source: Vmware_7a:e2:23 (00:0c:29:7a:e2:23)
        Address: Vmware_7a:e2:23 (00:0c:29:7a:e2:23)
        .... ..0. .... .... .... .... = LG bit: Globally unique address (factory default)
        .... ...0 .... .... .... .... = IG bit: Individual address (unicast)
    Type: IP (0x0800)
Internet Protocol Version 4, Src: 192.168.222.128 (192.168.222.128), Dst: 10.220.104.180 (10.220.104.180)
    Version: 4
    Header length: 20 bytes
    Differentiated Services Field: 0x00 (DSCP 0x00: Default; ECN: 0x00: Not-ECT (Not ECN-Capable Transport))
        0000 00.. = Differentiated Services Codepoint: Default (0x00)
        .... ..00 = Explicit Congestion Notification: Not-ECT (Not ECN-Capable Transport) (0x00)
    Total Length: 60
    Identification: 0xac5a (44122)
    Flags: 0x02 (Don't Fragment)
        0... .... = Reserved bit: Not set
        .1.. .... = Don't fragment: Set
        ..0. .... = More fragments: Not set
    Fragment offset: 0
    Time to live: 64
    Protocol: TCP (6)
    Header checksum: 0x7ba8 [correct]
        [Good: True]
        [Bad: False]
    Source: 192.168.222.128 (192.168.222.128)
    Destination: 10.220.104.180 (10.220.104.180)
    [Source GeoIP: Unknown]
    [Destination GeoIP: Unknown]
Transmission Control Protocol, Src Port: 44180 (44180), Dst Port: EtherNet-IP-2 (44818), Seq: 0, Len: 0
    Source port: 44180 (44180)
    Destination port: EtherNet-IP-2 (44818)
    [Stream index: 0]
    Sequence number: 0    (relative sequence number)
    Header length: 40 bytes
    Flags: 0x002 (SYN)
        000. .... .... = Reserved: Not set
        ...0 .... .... = Nonce: Not set
        .... 0... .... = Congestion Window Reduced (CWR): Not set
        .... .0.. .... = ECN-Echo: Not set
        .... ..0. .... = Urgent: Not set
        .... ...0 .... = Acknowledgment: Not set
        .... .... 0... = Push: Not set
        .... .... .0.. = Reset: Not set
        .... .... ..1. = Syn: Set
            [Expert Info (Chat/Sequence): Connection establish request (SYN): server port EtherNet-IP-2]
                [Message: Connection establish request (SYN): server port EtherNet-IP-2]
                [Severity level: Chat]
                [Group: Sequence]
        .... .... ...0 = Fin: Not set
    Window size value: 14600
    [Calculated window size: 14600]
    Checksum: 0x12e8 [validation disabled]
        [Good Checksum: False]
        [Bad Checksum: False]
    Options: (20 bytes), Maximum segment size, SACK permitted, Timestamps, No-Operation (NOP), Window scale
        Maximum segment size: 1460 bytes
            Kind: MSS size (2)
            Length: 4
            MSS Value: 1460
        TCP SACK Permitted Option: True
            Kind: SACK Permission (4)
            Length: 2
        Timestamps: TSval 95848, TSecr 0
            Kind: Timestamp (8)
            Length: 10
            Timestamp value: 95848
            Timestamp echo reply: 0
        No-Operation (NOP)
            Type: 1
                0... .... = Copy on fragmentation: No
                .00. .... = Class: Control (0)
                ...0 0001 = Number: No-Operation (NOP) (1)
        Window scale: 4 (multiply by 16)
            Kind: Window Scale (3)
            Length: 3
            Shift count: 4
            [Multiplier: 16]

0000  00 50 56 fb 35 e0 00 0c 29 7a e2 23 08 00 45 00   .PV.5...)z.#..E.
0010  00 3c ac 5a 40 00 40 06 7b a8 c0 a8 de 80 0a dc   .<.Z@.@.{.......
0020  68 b4 ac 94 af 12 98 18 da 32 00 00 00 00 a0 02   h........2......
0030  39 08 12 e8 00 00 02 04 05 b4 04 02 08 0a 00 01   9...............
0040  76 68 00 00 00 00 01 03 03 04                     vh........

No.     Time           Source                Destination           Protocol Length Info
      2 0.000349000    10.220.104.180        192.168.222.128       TCP      60     EtherNet-IP-2 > 44180 [SYN, ACK] Seq=0 Ack=1 Win=64240 Len=0 MSS=1460

Frame 2: 60 bytes on wire (480 bits), 60 bytes captured (480 bits) on interface 0
    Interface id: 0
    WTAP_ENCAP: 1
    Arrival Time: May  7, 2013 11:27:17.492730000 MST
    [Time shift for this packet: 0.000000000 seconds]
    Epoch Time: 1367951237.492730000 seconds
    [Time delta from previous captured frame: 0.000349000 seconds]
    [Time delta from previous displayed frame: 0.000349000 seconds]
    [Time since reference or first frame: 0.000349000 seconds]
    Frame Number: 2
    Frame Length: 60 bytes (480 bits)
    Capture Length: 60 bytes (480 bits)
    [Frame is marked: False]
    [Frame is ignored: False]
    [Protocols in frame: eth:ip:tcp]
    [Coloring Rule Name: TCP SYN/FIN]
    [Coloring Rule String: tcp.flags & 0x02 || tcp.flags.fin == 1]
Ethernet II, Src: Vmware_fb:35:e0 (00:50:56:fb:35:e0), Dst: Vmware_7a:e2:23 (00:0c:29:7a:e2:23)
    Destination: Vmware_7a:e2:23 (00:0c:29:7a:e2:23)
        Address: Vmware_7a:e2:23 (00:0c:29:7a:e2:23)
        .... ..0. .... .... .... .... = LG bit: Globally unique address (factory default)
        .... ...0 .... .... .... .... = IG bit: Individual address (unicast)
    Source: Vmware_fb:35:e0 (00:50:56:fb:35:e0)
        Address: Vmware_fb:35:e0 (00:50:56:fb:35:e0)
        .... ..0. .... .... .... .... = LG bit: Globally unique address (factory default)
        .... ...0 .... .... .... .... = IG bit: Individual address (unicast)
    Type: IP (0x0800)
    Padding: 0000
Internet Protocol Version 4, Src: 10.220.104.180 (10.220.104.180), Dst: 192.168.222.128 (192.168.222.128)
    Version: 4
    Header length: 20 bytes
    Differentiated Services Field: 0x00 (DSCP 0x00: Default; ECN: 0x00: Not-ECT (Not ECN-Capable Transport))
        0000 00.. = Differentiated Services Codepoint: Default (0x00)
        .... ..00 = Explicit Congestion Notification: Not-ECT (Not ECN-Capable Transport) (0x00)
    Total Length: 44
    Identification: 0x8320 (33568)
    Flags: 0x00
        0... .... = Reserved bit: Not set
        .0.. .... = Don't fragment: Not set
        ..0. .... = More fragments: Not set
    Fragment offset: 0
    Time to live: 128
    Protocol: TCP (6)
    Header checksum: 0xa4f2 [correct]
        [Good: True]
        [Bad: False]
    Source: 10.220.104.180 (10.220.104.180)
    Destination: 192.168.222.128 (192.168.222.128)
    [Source GeoIP: Unknown]
    [Destination GeoIP: Unknown]
Transmission Control Protocol, Src Port: EtherNet-IP-2 (44818), Dst Port: 44180 (44180), Seq: 0, Ack: 1, Len: 0
    Source port: EtherNet-IP-2 (44818)
    Destination port: 44180 (44180)
    [Stream index: 0]
    Sequence number: 0    (relative sequence number)
    Acknowledgment number: 1    (relative ack number)
    Header length: 24 bytes
    Flags: 0x012 (SYN, ACK)
        000. .... .... = Reserved: Not set
        ...0 .... .... = Nonce: Not set
        .... 0... .... = Congestion Window Reduced (CWR): Not set
        .... .0.. .... = ECN-Echo: Not set
        .... ..0. .... = Urgent: Not set
        .... ...1 .... = Acknowledgment: Set
        .... .... 0... = Push: Not set
        .... .... .0.. = Reset: Not set
        .... .... ..1. = Syn: Set
            [Expert Info (Chat/Sequence): Connection establish acknowledge (SYN+ACK): server port EtherNet-IP-2]
                [Message: Connection establish acknowledge (SYN+ACK): server port EtherNet-IP-2]
                [Severity level: Chat]
                [Group: Sequence]
        .... .... ...0 = Fin: Not set
    Window size value: 64240
    [Calculated window size: 64240]
    Checksum: 0x2c50 [validation disabled]
        [Good Checksum: False]
        [Bad Checksum: False]
    Options: (4 bytes), Maximum segment size
        Maximum segment size: 1460 bytes
            Kind: MSS size (2)
            Length: 4
            MSS Value: 1460
    [SEQ/ACK analysis]
        [This is an ACK to the segment in frame: 1]
        [The RTT to ACK the segment was: 0.000349000 seconds]

0000  00 0c 29 7a e2 23 00 50 56 fb 35 e0 08 00 45 00   ..)z.#.PV.5...E.
0010  00 2c 83 20 00 00 80 06 a4 f2 0a dc 68 b4 c0 a8   .,. ........h...
0020  de 80 af 12 ac 94 02 ab 8d 7d 98 18 da 33 60 12   .........}...3`.
0030  fa f0 2c 50 00 00 02 04 05 b4 00 00               ..,P........

No.     Time           Source                Destination           Protocol Length Info
      3 0.000426000    192.168.222.128       10.220.104.180        TCP      54     44180 > EtherNet-IP-2 [ACK] Seq=1 Ack=1 Win=14600 Len=0

Frame 3: 54 bytes on wire (432 bits), 54 bytes captured (432 bits) on interface 0
    Interface id: 0
    WTAP_ENCAP: 1
    Arrival Time: May  7, 2013 11:27:17.492807000 MST
    [Time shift for this packet: 0.000000000 seconds]
    Epoch Time: 1367951237.492807000 seconds
    [Time delta from previous captured frame: 0.000077000 seconds]
    [Time delta from previous displayed frame: 0.000077000 seconds]
    [Time since reference or first frame: 0.000426000 seconds]
    Frame Number: 3
    Frame Length: 54 bytes (432 bits)
    Capture Length: 54 bytes (432 bits)
    [Frame is marked: False]
    [Frame is ignored: False]
    [Protocols in frame: eth:ip:tcp]
    [Coloring Rule Name: TCP]
    [Coloring Rule String: tcp]
Ethernet II, Src: Vmware_7a:e2:23 (00:0c:29:7a:e2:23), Dst: Vmware_fb:35:e0 (00:50:56:fb:35:e0)
    Destination: Vmware_fb:35:e0 (00:50:56:fb:35:e0)
        Address: Vmware_fb:35:e0 (00:50:56:fb:35:e0)
        .... ..0. .... .... .... .... = LG bit: Globally unique address (factory default)
        .... ...0 .... .... .... .... = IG bit: Individual address (unicast)
    Source: Vmware_7a:e2:23 (00:0c:29:7a:e2:23)
        Address: Vmware_7a:e2:23 (00:0c:29:7a:e2:23)
        .... ..0. .... .... .... .... = LG bit: Globally unique address (factory default)
        .... ...0 .... .... .... .... = IG bit: Individual address (unicast)
    Type: IP (0x0800)
Internet Protocol Version 4, Src: 192.168.222.128 (192.168.222.128), Dst: 10.220.104.180 (10.220.104.180)
    Version: 4
    Header length: 20 bytes
    Differentiated Services Field: 0x00 (DSCP 0x00: Default; ECN: 0x00: Not-ECT (Not ECN-Capable Transport))
        0000 00.. = Differentiated Services Codepoint: Default (0x00)
        .... ..00 = Explicit Congestion Notification: Not-ECT (Not ECN-Capable Transport) (0x00)
    Total Length: 40
    Identification: 0xac5b (44123)
    Flags: 0x02 (Don't Fragment)
        0... .... = Reserved bit: Not set
        .1.. .... = Don't fragment: Set
        ..0. .... = More fragments: Not set
    Fragment offset: 0
    Time to live: 64
    Protocol: TCP (6)
    Header checksum: 0x7bbb [correct]
        [Good: True]
        [Bad: False]
    Source: 192.168.222.128 (192.168.222.128)
    Destination: 10.220.104.180 (10.220.104.180)
    [Source GeoIP: Unknown]
    [Destination GeoIP: Unknown]
Transmission Control Protocol, Src Port: 44180 (44180), Dst Port: EtherNet-IP-2 (44818), Seq: 1, Ack: 1, Len: 0
    Source port: 44180 (44180)
    Destination port: EtherNet-IP-2 (44818)
    [Stream index: 0]
    Sequence number: 1    (relative sequence number)
    Acknowledgment number: 1    (relative ack number)
    Header length: 20 bytes
    Flags: 0x010 (ACK)
        000. .... .... = Reserved: Not set
        ...0 .... .... = Nonce: Not set
        .... 0... .... = Congestion Window Reduced (CWR): Not set
        .... .0.. .... = ECN-Echo: Not set
        .... ..0. .... = Urgent: Not set
        .... ...1 .... = Acknowledgment: Set
        .... .... 0... = Push: Not set
        .... .... .0.. = Reset: Not set
        .... .... ..0. = Syn: Not set
        .... .... ...0 = Fin: Not set
    Window size value: 14600
    [Calculated window size: 14600]
    [Window size scaling factor: -2 (no window scaling used)]
    Checksum: 0x12d4 [validation disabled]
        [Good Checksum: False]
        [Bad Checksum: False]
    [SEQ/ACK analysis]
        [This is an ACK to the segment in frame: 2]
        [The RTT to ACK the segment was: 0.000077000 seconds]

0000  00 50 56 fb 35 e0 00 0c 29 7a e2 23 08 00 45 00   .PV.5...)z.#..E.
0010  00 28 ac 5b 40 00 40 06 7b bb c0 a8 de 80 0a dc   .(.[@.@.{.......
0020  68 b4 ac 94 af 12 98 18 da 33 02 ab 8d 7e 50 10   h........3...~P.
0030  39 08 12 d4 00 00                                 9.....

No.     Time           Source                Destination           Protocol Length Info
      4 0.000863000    192.168.222.128       10.220.104.180        ENIP     82     Register Session (Req), Session: 0x00000000

Frame 4: 82 bytes on wire (656 bits), 82 bytes captured (656 bits) on interface 0
    Interface id: 0
    WTAP_ENCAP: 1
    Arrival Time: May  7, 2013 11:27:17.493244000 MST
    [Time shift for this packet: 0.000000000 seconds]
    Epoch Time: 1367951237.493244000 seconds
    [Time delta from previous captured frame: 0.000437000 seconds]
    [Time delta from previous displayed frame: 0.000437000 seconds]
    [Time since reference or first frame: 0.000863000 seconds]
    Frame Number: 4
    Frame Length: 82 bytes (656 bits)
    Capture Length: 82 bytes (656 bits)
    [Frame is marked: False]
    [Frame is ignored: False]
    [Protocols in frame: eth:ip:tcp:enip]
    [Coloring Rule Name: TCP]
    [Coloring Rule String: tcp]
Ethernet II, Src: Vmware_7a:e2:23 (00:0c:29:7a:e2:23), Dst: Vmware_fb:35:e0 (00:50:56:fb:35:e0)
    Destination: Vmware_fb:35:e0 (00:50:56:fb:35:e0)
        Address: Vmware_fb:35:e0 (00:50:56:fb:35:e0)
        .... ..0. .... .... .... .... = LG bit: Globally unique address (factory default)
        .... ...0 .... .... .... .... = IG bit: Individual address (unicast)
    Source: Vmware_7a:e2:23 (00:0c:29:7a:e2:23)
        Address: Vmware_7a:e2:23 (00:0c:29:7a:e2:23)
        .... ..0. .... .... .... .... = LG bit: Globally unique address (factory default)
        .... ...0 .... .... .... .... = IG bit: Individual address (unicast)
    Type: IP (0x0800)
Internet Protocol Version 4, Src: 192.168.222.128 (192.168.222.128), Dst: 10.220.104.180 (10.220.104.180)
    Version: 4
    Header length: 20 bytes
    Differentiated Services Field: 0x00 (DSCP 0x00: Default; ECN: 0x00: Not-ECT (Not ECN-Capable Transport))
        0000 00.. = Differentiated Services Codepoint: Default (0x00)
        .... ..00 = Explicit Congestion Notification: Not-ECT (Not ECN-Capable Transport) (0x00)
    Total Length: 68
    Identification: 0xac5c (44124)
    Flags: 0x02 (Don't Fragment)
        0... .... = Reserved bit: Not set
        .1.. .... = Don't fragment: Set
        ..0. .... = More fragments: Not set
    Fragment offset: 0
    Time to live: 64
    Protocol: TCP (6)
    Header checksum: 0x7b9e [correct]
        [Good: True]
        [Bad: False]
    Source: 192.168.222.128 (192.168.222.128)
    Destination: 10.220.104.180 (10.220.104.180)
    [Source GeoIP: Unknown]
    [Destination GeoIP: Unknown]
Transmission Control Protocol, Src Port: 44180 (44180), Dst Port: EtherNet-IP-2 (44818), Seq: 1, Ack: 1, Len: 28
    Source port: 44180 (44180)
    Destination port: EtherNet-IP-2 (44818)
    [Stream index: 0]
    Sequence number: 1    (relative sequence number)
    [Next sequence number: 29    (relative sequence number)]
    Acknowledgment number: 1    (relative ack number)
    Header length: 20 bytes
    Flags: 0x018 (PSH, ACK)
        000. .... .... = Reserved: Not set
        ...0 .... .... = Nonce: Not set
        .... 0... .... = Congestion Window Reduced (CWR): Not set
        .... .0.. .... = ECN-Echo: Not set
        .... ..0. .... = Urgent: Not set
        .... ...1 .... = Acknowledgment: Set
        .... .... 1... = Push: Set
        .... .... .0.. = Reset: Not set
        .... .... ..0. = Syn: Not set
        .... .... ...0 = Fin: Not set
    Window size value: 14600
    [Calculated window size: 14600]
    [Window size scaling factor: -2 (no window scaling used)]
    Checksum: 0x9bd1 [validation disabled]
        [Good Checksum: False]
        [Bad Checksum: False]
    [SEQ/ACK analysis]
        [Bytes in flight: 28]
    [PDU Size: 28]
EtherNet/IP (Industrial Protocol), Session: 0x00000000, Register Session
    Encapsulation Header
        Command: Register Session (0x0065)
        Length: 4
        Session Handle: 0x00000000
        Status: Success (0x00000000)
        Sender Context: 0000000000000000
        Options: 0x00000000
    Command Specific Data
        Protocol Version: 1
        Option Flags: 0x0000

0000  00 50 56 fb 35 e0 00 0c 29 7a e2 23 08 00 45 00   .PV.5...)z.#..E.
0010  00 44 ac 5c 40 00 40 06 7b 9e c0 a8 de 80 0a dc   .D.\@.@.{.......
0020  68 b4 ac 94 af 12 98 18 da 33 02 ab 8d 7e 50 18   h........3...~P.
0030  39 08 9b d1 00 00 65 00 04 00 00 00 00 00 00 00   9.....e.........
0040  00 00 00 00 00 00 00 00 00 00 00 00 00 00 01 00   ................
0050  00 00                                             ..

No.     Time           Source                Destination           Protocol Length Info
      5 0.001030000    10.220.104.180        192.168.222.128       TCP      60     EtherNet-IP-2 > 44180 [ACK] Seq=1 Ack=29 Win=64240 Len=0

Frame 5: 60 bytes on wire (480 bits), 60 bytes captured (480 bits) on interface 0
    Interface id: 0
    WTAP_ENCAP: 1
    Arrival Time: May  7, 2013 11:27:17.493411000 MST
    [Time shift for this packet: 0.000000000 seconds]
    Epoch Time: 1367951237.493411000 seconds
    [Time delta from previous captured frame: 0.000167000 seconds]
    [Time delta from previous displayed frame: 0.000167000 seconds]
    [Time since reference or first frame: 0.001030000 seconds]
    Frame Number: 5
    Frame Length: 60 bytes (480 bits)
    Capture Length: 60 bytes (480 bits)
    [Frame is marked: False]
    [Frame is ignored: False]
    [Protocols in frame: eth:ip:tcp]
    [Coloring Rule Name: TCP]
    [Coloring Rule String: tcp]
Ethernet II, Src: Vmware_fb:35:e0 (00:50:56:fb:35:e0), Dst: Vmware_7a:e2:23 (00:0c:29:7a:e2:23)
    Destination: Vmware_7a:e2:23 (00:0c:29:7a:e2:23)
        Address: Vmware_7a:e2:23 (00:0c:29:7a:e2:23)
        .... ..0. .... .... .... .... = LG bit: Globally unique address (factory default)
        .... ...0 .... .... .... .... = IG bit: Individual address (unicast)
    Source: Vmware_fb:35:e0 (00:50:56:fb:35:e0)
        Address: Vmware_fb:35:e0 (00:50:56:fb:35:e0)
        .... ..0. .... .... .... .... = LG bit: Globally unique address (factory default)
        .... ...0 .... .... .... .... = IG bit: Individual address (unicast)
    Type: IP (0x0800)
    Padding: 000000000000
Internet Protocol Version 4, Src: 10.220.104.180 (10.220.104.180), Dst: 192.168.222.128 (192.168.222.128)
    Version: 4
    Header length: 20 bytes
    Differentiated Services Field: 0x00 (DSCP 0x00: Default; ECN: 0x00: Not-ECT (Not ECN-Capable Transport))
        0000 00.. = Differentiated Services Codepoint: Default (0x00)
        .... ..00 = Explicit Congestion Notification: Not-ECT (Not ECN-Capable Transport) (0x00)
    Total Length: 40
    Identification: 0x8321 (33569)
    Flags: 0x00
        0... .... = Reserved bit: Not set
        .0.. .... = Don't fragment: Not set
        ..0. .... = More fragments: Not set
    Fragment offset: 0
    Time to live: 128
    Protocol: TCP (6)
    Header checksum: 0xa4f5 [correct]
        [Good: True]
        [Bad: False]
    Source: 10.220.104.180 (10.220.104.180)
    Destination: 192.168.222.128 (192.168.222.128)
    [Source GeoIP: Unknown]
    [Destination GeoIP: Unknown]
Transmission Control Protocol, Src Port: EtherNet-IP-2 (44818), Dst Port: 44180 (44180), Seq: 1, Ack: 29, Len: 0
    Source port: EtherNet-IP-2 (44818)
    Destination port: 44180 (44180)
    [Stream index: 0]
    Sequence number: 1    (relative sequence number)
    Acknowledgment number: 29    (relative ack number)
    Header length: 20 bytes
    Flags: 0x010 (ACK)
        000. .... .... = Reserved: Not set
        ...0 .... .... = Nonce: Not set
        .... 0... .... = Congestion Window Reduced (CWR): Not set
        .... .0.. .... = ECN-Echo: Not set
        .... ..0. .... = Urgent: Not set
        .... ...1 .... = Acknowledgment: Set
        .... .... 0... = Push: Not set
        .... .... .0.. = Reset: Not set
        .... .... ..0. = Syn: Not set
        .... .... ...0 = Fin: Not set
    Window size value: 64240
    [Calculated window size: 64240]
    [Window size scaling factor: -2 (no window scaling used)]
    Checksum: 0x43f1 [validation disabled]
        [Good Checksum: False]
        [Bad Checksum: False]
    [SEQ/ACK analysis]
        [This is an ACK to the segment in frame: 4]
        [The RTT to ACK the segment was: 0.000167000 seconds]

0000  00 0c 29 7a e2 23 00 50 56 fb 35 e0 08 00 45 00   ..)z.#.PV.5...E.
0010  00 28 83 21 00 00 80 06 a4 f5 0a dc 68 b4 c0 a8   .(.!........h...
0020  de 80 af 12 ac 94 02 ab 8d 7e 98 18 da 4f 50 10   .........~...OP.
0030  fa f0 43 f1 00 00 00 00 00 00 00 00               ..C.........

No.     Time           Source                Destination           Protocol Length Info
      6 0.152924000    10.220.104.180        192.168.222.128       ENIP     82     Register Session (Rsp), Session: 0x11021E01

Frame 6: 82 bytes on wire (656 bits), 82 bytes captured (656 bits) on interface 0
    Interface id: 0
    WTAP_ENCAP: 1
    Arrival Time: May  7, 2013 11:27:17.645305000 MST
    [Time shift for this packet: 0.000000000 seconds]
    Epoch Time: 1367951237.645305000 seconds
    [Time delta from previous captured frame: 0.151894000 seconds]
    [Time delta from previous displayed frame: 0.151894000 seconds]
    [Time since reference or first frame: 0.152924000 seconds]
    Frame Number: 6
    Frame Length: 82 bytes (656 bits)
    Capture Length: 82 bytes (656 bits)
    [Frame is marked: False]
    [Frame is ignored: False]
    [Protocols in frame: eth:ip:tcp:enip]
    [Coloring Rule Name: TCP]
    [Coloring Rule String: tcp]
Ethernet II, Src: Vmware_fb:35:e0 (00:50:56:fb:35:e0), Dst: Vmware_7a:e2:23 (00:0c:29:7a:e2:23)
    Destination: Vmware_7a:e2:23 (00:0c:29:7a:e2:23)
        Address: Vmware_7a:e2:23 (00:0c:29:7a:e2:23)
        .... ..0. .... .... .... .... = LG bit: Globally unique address (factory default)
        .... ...0 .... .... .... .... = IG bit: Individual address (unicast)
    Source: Vmware_fb:35:e0 (00:50:56:fb:35:e0)
        Address: Vmware_fb:35:e0 (00:50:56:fb:35:e0)
        .... ..0. .... .... .... .... = LG bit: Globally unique address (factory default)
        .... ...0 .... .... .... .... = IG bit: Individual address (unicast)
    Type: IP (0x0800)
Internet Protocol Version 4, Src: 10.220.104.180 (10.220.104.180), Dst: 192.168.222.128 (192.168.222.128)
    Version: 4
    Header length: 20 bytes
    Differentiated Services Field: 0x00 (DSCP 0x00: Default; ECN: 0x00: Not-ECT (Not ECN-Capable Transport))
        0000 00.. = Differentiated Services Codepoint: Default (0x00)
        .... ..00 = Explicit Congestion Notification: Not-ECT (Not ECN-Capable Transport) (0x00)
    Total Length: 68
    Identification: 0x8322 (33570)
    Flags: 0x00
        0... .... = Reserved bit: Not set
        .0.. .... = Don't fragment: Not set
        ..0. .... = More fragments: Not set
    Fragment offset: 0
    Time to live: 128
    Protocol: TCP (6)
    Header checksum: 0xa4d8 [correct]
        [Good: True]
        [Bad: False]
    Source: 10.220.104.180 (10.220.104.180)
    Destination: 192.168.222.128 (192.168.222.128)
    [Source GeoIP: Unknown]
    [Destination GeoIP: Unknown]
Transmission Control Protocol, Src Port: EtherNet-IP-2 (44818), Dst Port: 44180 (44180), Seq: 1, Ack: 29, Len: 28
    Source port: EtherNet-IP-2 (44818)
    Destination port: 44180 (44180)
    [Stream index: 0]
    Sequence number: 1    (relative sequence number)
    [Next sequence number: 29    (relative sequence number)]
    Acknowledgment number: 29    (relative ack number)
    Header length: 20 bytes
    Flags: 0x018 (PSH, ACK)
        000. .... .... = Reserved: Not set
        ...0 .... .... = Nonce: Not set
        .... 0... .... = Congestion Window Reduced (CWR): Not set
        .... .0.. .... = ECN-Echo: Not set
        .... ..0. .... = Urgent: Not set
        .... ...1 .... = Acknowledgment: Set
        .... .... 1... = Push: Set
        .... .... .0.. = Reset: Not set
        .... .... ..0. = Syn: Not set
        .... .... ...0 = Fin: Not set
    Window size value: 64240
    [Calculated window size: 64240]
    [Window size scaling factor: -2 (no window scaling used)]
    Checksum: 0xd69d [validation disabled]
        [Good Checksum: False]
        [Bad Checksum: False]
    [SEQ/ACK analysis]
        [Bytes in flight: 28]
    [PDU Size: 28]
EtherNet/IP (Industrial Protocol), Session: 0x11021E01, Register Session
    Encapsulation Header
        Command: Register Session (0x0065)
        Length: 4
        Session Handle: 0x11021e01
        Status: Success (0x00000000)
        Sender Context: 0000000000000000
        Options: 0x00000000
    Command Specific Data
        Protocol Version: 1
        Option Flags: 0x0000

0000  00 0c 29 7a e2 23 00 50 56 fb 35 e0 08 00 45 00   ..)z.#.PV.5...E.
0010  00 44 83 22 00 00 80 06 a4 d8 0a dc 68 b4 c0 a8   .D."........h...
0020  de 80 af 12 ac 94 02 ab 8d 7e 98 18 da 4f 50 18   .........~...OP.
0030  fa f0 d6 9d 00 00 65 00 04 00 01 1e 02 11 00 00   ......e.........
0040  00 00 00 00 00 00 00 00 00 00 00 00 00 00 01 00   ................
0050  00 00                                             ..

No.     Time           Source                Destination           Protocol Length Info
      7 0.152949000    192.168.222.128       10.220.104.180        TCP      54     44180 > EtherNet-IP-2 [ACK] Seq=29 Ack=29 Win=14600 Len=0

Frame 7: 54 bytes on wire (432 bits), 54 bytes captured (432 bits) on interface 0
    Interface id: 0
    WTAP_ENCAP: 1
    Arrival Time: May  7, 2013 11:27:17.645330000 MST
    [Time shift for this packet: 0.000000000 seconds]
    Epoch Time: 1367951237.645330000 seconds
    [Time delta from previous captured frame: 0.000025000 seconds]
    [Time delta from previous displayed frame: 0.000025000 seconds]
    [Time since reference or first frame: 0.152949000 seconds]
    Frame Number: 7
    Frame Length: 54 bytes (432 bits)
    Capture Length: 54 bytes (432 bits)
    [Frame is marked: False]
    [Frame is ignored: False]
    [Protocols in frame: eth:ip:tcp]
    [Coloring Rule Name: TCP]
    [Coloring Rule String: tcp]
Ethernet II, Src: Vmware_7a:e2:23 (00:0c:29:7a:e2:23), Dst: Vmware_fb:35:e0 (00:50:56:fb:35:e0)
    Destination: Vmware_fb:35:e0 (00:50:56:fb:35:e0)
        Address: Vmware_fb:35:e0 (00:50:56:fb:35:e0)
        .... ..0. .... .... .... .... = LG bit: Globally unique address (factory default)
        .... ...0 .... .... .... .... = IG bit: Individual address (unicast)
    Source: Vmware_7a:e2:23 (00:0c:29:7a:e2:23)
        Address: Vmware_7a:e2:23 (00:0c:29:7a:e2:23)
        .... ..0. .... .... .... .... = LG bit: Globally unique address (factory default)
        .... ...0 .... .... .... .... = IG bit: Individual address (unicast)
    Type: IP (0x0800)
Internet Protocol Version 4, Src: 192.168.222.128 (192.168.222.128), Dst: 10.220.104.180 (10.220.104.180)
    Version: 4
    Header length: 20 bytes
    Differentiated Services Field: 0x00 (DSCP 0x00: Default; ECN: 0x00: Not-ECT (Not ECN-Capable Transport))
        0000 00.. = Differentiated Services Codepoint: Default (0x00)
        .... ..00 = Explicit Congestion Notification: Not-ECT (Not ECN-Capable Transport) (0x00)
    Total Length: 40
    Identification: 0xac5d (44125)
    Flags: 0x02 (Don't Fragment)
        0... .... = Reserved bit: Not set
        .1.. .... = Don't fragment: Set
        ..0. .... = More fragments: Not set
    Fragment offset: 0
    Time to live: 64
    Protocol: TCP (6)
    Header checksum: 0x7bb9 [correct]
        [Good: True]
        [Bad: False]
    Source: 192.168.222.128 (192.168.222.128)
    Destination: 10.220.104.180 (10.220.104.180)
    [Source GeoIP: Unknown]
    [Destination GeoIP: Unknown]
Transmission Control Protocol, Src Port: 44180 (44180), Dst Port: EtherNet-IP-2 (44818), Seq: 29, Ack: 29, Len: 0
    Source port: 44180 (44180)
    Destination port: EtherNet-IP-2 (44818)
    [Stream index: 0]
    Sequence number: 29    (relative sequence number)
    Acknowledgment number: 29    (relative ack number)
    Header length: 20 bytes
    Flags: 0x010 (ACK)
        000. .... .... = Reserved: Not set
        ...0 .... .... = Nonce: Not set
        .... 0... .... = Congestion Window Reduced (CWR): Not set
        .... .0.. .... = ECN-Echo: Not set
        .... ..0. .... = Urgent: Not set
        .... ...1 .... = Acknowledgment: Set
        .... .... 0... = Push: Not set
        .... .... .0.. = Reset: Not set
        .... .... ..0. = Syn: Not set
        .... .... ...0 = Fin: Not set
    Window size value: 14600
    [Calculated window size: 14600]
    [Window size scaling factor: -2 (no window scaling used)]
    Checksum: 0x12d4 [validation disabled]
        [Good Checksum: False]
        [Bad Checksum: False]
    [SEQ/ACK analysis]
        [This is an ACK to the segment in frame: 6]
        [The RTT to ACK the segment was: 0.000025000 seconds]

0000  00 50 56 fb 35 e0 00 0c 29 7a e2 23 08 00 45 00   .PV.5...)z.#..E.
0010  00 28 ac 5d 40 00 40 06 7b b9 c0 a8 de 80 0a dc   .(.]@.@.{.......
0020  68 b4 ac 94 af 12 98 18 da 4f 02 ab 8d 9a 50 10   h........O....P.
0030  39 08 12 d4 00 00                                 9.....

No.     Time           Source                Destination           Protocol Length Info
      8 0.153249000    192.168.222.128       10.220.104.180        CIP      100    Get Attribute All

Frame 8: 100 bytes on wire (800 bits), 100 bytes captured (800 bits) on interface 0
    Interface id: 0
    WTAP_ENCAP: 1
    Arrival Time: May  7, 2013 11:27:17.645630000 MST
    [Time shift for this packet: 0.000000000 seconds]
    Epoch Time: 1367951237.645630000 seconds
    [Time delta from previous captured frame: 0.000300000 seconds]
    [Time delta from previous displayed frame: 0.000300000 seconds]
    [Time since reference or first frame: 0.153249000 seconds]
    Frame Number: 8
    Frame Length: 100 bytes (800 bits)
    Capture Length: 100 bytes (800 bits)
    [Frame is marked: False]
    [Frame is ignored: False]
    [Protocols in frame: eth:ip:tcp:enip:cip]
    [Coloring Rule Name: TCP]
    [Coloring Rule String: tcp]
Ethernet II, Src: Vmware_7a:e2:23 (00:0c:29:7a:e2:23), Dst: Vmware_fb:35:e0 (00:50:56:fb:35:e0)
    Destination: Vmware_fb:35:e0 (00:50:56:fb:35:e0)
        Address: Vmware_fb:35:e0 (00:50:56:fb:35:e0)
        .... ..0. .... .... .... .... = LG bit: Globally unique address (factory default)
        .... ...0 .... .... .... .... = IG bit: Individual address (unicast)
    Source: Vmware_7a:e2:23 (00:0c:29:7a:e2:23)
        Address: Vmware_7a:e2:23 (00:0c:29:7a:e2:23)
        .... ..0. .... .... .... .... = LG bit: Globally unique address (factory default)
        .... ...0 .... .... .... .... = IG bit: Individual address (unicast)
    Type: IP (0x0800)
Internet Protocol Version 4, Src: 192.168.222.128 (192.168.222.128), Dst: 10.220.104.180 (10.220.104.180)
    Version: 4
    Header length: 20 bytes
    Differentiated Services Field: 0x00 (DSCP 0x00: Default; ECN: 0x00: Not-ECT (Not ECN-Capable Transport))
        0000 00.. = Differentiated Services Codepoint: Default (0x00)
        .... ..00 = Explicit Congestion Notification: Not-ECT (Not ECN-Capable Transport) (0x00)
    Total Length: 86
    Identification: 0xac5e (44126)
    Flags: 0x02 (Don't Fragment)
        0... .... = Reserved bit: Not set
        .1.. .... = Don't fragment: Set
        ..0. .... = More fragments: Not set
    Fragment offset: 0
    Time to live: 64
    Protocol: TCP (6)
    Header checksum: 0x7b8a [correct]
        [Good: True]
        [Bad: False]
    Source: 192.168.222.128 (192.168.222.128)
    Destination: 10.220.104.180 (10.220.104.180)
    [Source GeoIP: Unknown]
    [Destination GeoIP: Unknown]
Transmission Control Protocol, Src Port: 44180 (44180), Dst Port: EtherNet-IP-2 (44818), Seq: 29, Ack: 29, Len: 46
    Source port: 44180 (44180)
    Destination port: EtherNet-IP-2 (44818)
    [Stream index: 0]
    Sequence number: 29    (relative sequence number)
    [Next sequence number: 75    (relative sequence number)]
    Acknowledgment number: 29    (relative ack number)
    Header length: 20 bytes
    Flags: 0x018 (PSH, ACK)
        000. .... .... = Reserved: Not set
        ...0 .... .... = Nonce: Not set
        .... 0... .... = Congestion Window Reduced (CWR): Not set
        .... .0.. .... = ECN-Echo: Not set
        .... ..0. .... = Urgent: Not set
        .... ...1 .... = Acknowledgment: Set
        .... .... 1... = Push: Set
        .... .... .0.. = Reset: Not set
        .... .... ..0. = Syn: Not set
        .... .... ...0 = Fin: Not set
    Window size value: 14600
    [Calculated window size: 14600]
    [Window size scaling factor: -2 (no window scaling used)]
    Checksum: 0x77ee [validation disabled]
        [Good Checksum: False]
        [Bad Checksum: False]
    [SEQ/ACK analysis]
        [Bytes in flight: 46]
    [PDU Size: 46]
EtherNet/IP (Industrial Protocol), Session: 0x11021E01, Send RR Data
    Encapsulation Header
        Command: Send RR Data (0x006f)
        Length: 22
        Session Handle: 0x11021e01
        Status: Success (0x00000000)
        Sender Context: 0100000000000000
        Options: 0x00000000
    Command Specific Data
        Interface Handle: CIP (0x00000000)
        Timeout: 5
        Item Count: 2
            Type ID: Null Address Item (0x0000)
                Length: 0
            Type ID: Unconnected Data Item (0x00b2)
                Length: 6
        [Response In: 10]
Common Industrial Protocol
    Service: Get Attribute All (Request)
        0... .... = Request/Response: Request (0x00)
        .000 0001 = Service: Get Attribute All (0x01)
    Request Path Size: 2 (words)
    Request Path: Class: 0x66, Instance: 0x01
        Path Segment: 0x20 (8-Bit Class Segment)
            001. .... = Path Segment Type: Logical Segment (1)
            ...0 00.. = Logical Segment Type: Class ID (0)
            .... ..00 = Logical Segment Format: 8-bit Logical Segment (0)
            8-Bit Class Segment
                Class: Unknown (0x66)
        Path Segment: 0x24 (8-Bit Instance Segment)
            001. .... = Path Segment Type: Logical Segment (1)
            ...0 01.. = Logical Segment Type: Instance ID (1)
            .... ..00 = Logical Segment Format: 8-bit Logical Segment (0)
            8-Bit Instance Segment
                Instance: 0x01
    Get Attribute All (Request)

0000  00 50 56 fb 35 e0 00 0c 29 7a e2 23 08 00 45 00   .PV.5...)z.#..E.
0010  00 56 ac 5e 40 00 40 06 7b 8a c0 a8 de 80 0a dc   .V.^@.@.{.......
0020  68 b4 ac 94 af 12 98 18 da 4f 02 ab 8d 9a 50 18   h........O....P.
0030  39 08 77 ee 00 00 6f 00 16 00 01 1e 02 11 00 00   9.w...o.........
0040  00 00 01 00 00 00 00 00 00 00 00 00 00 00 00 00   ................
0050  00 00 05 00 02 00 00 00 00 00 b2 00 06 00 01 02   ................
0060  20 66 24 01                                        f$.

No.     Time           Source                Destination           Protocol Length Info
      9 0.153377000    10.220.104.180        192.168.222.128       TCP      60     EtherNet-IP-2 > 44180 [ACK] Seq=29 Ack=75 Win=64240 Len=0

Frame 9: 60 bytes on wire (480 bits), 60 bytes captured (480 bits) on interface 0
    Interface id: 0
    WTAP_ENCAP: 1
    Arrival Time: May  7, 2013 11:27:17.645758000 MST
    [Time shift for this packet: 0.000000000 seconds]
    Epoch Time: 1367951237.645758000 seconds
    [Time delta from previous captured frame: 0.000128000 seconds]
    [Time delta from previous displayed frame: 0.000128000 seconds]
    [Time since reference or first frame: 0.153377000 seconds]
    Frame Number: 9
    Frame Length: 60 bytes (480 bits)
    Capture Length: 60 bytes (480 bits)
    [Frame is marked: False]
    [Frame is ignored: False]
    [Protocols in frame: eth:ip:tcp]
    [Coloring Rule Name: TCP]
    [Coloring Rule String: tcp]
Ethernet II, Src: Vmware_fb:35:e0 (00:50:56:fb:35:e0), Dst: Vmware_7a:e2:23 (00:0c:29:7a:e2:23)
    Destination: Vmware_7a:e2:23 (00:0c:29:7a:e2:23)
        Address: Vmware_7a:e2:23 (00:0c:29:7a:e2:23)
        .... ..0. .... .... .... .... = LG bit: Globally unique address (factory default)
        .... ...0 .... .... .... .... = IG bit: Individual address (unicast)
    Source: Vmware_fb:35:e0 (00:50:56:fb:35:e0)
        Address: Vmware_fb:35:e0 (00:50:56:fb:35:e0)
        .... ..0. .... .... .... .... = LG bit: Globally unique address (factory default)
        .... ...0 .... .... .... .... = IG bit: Individual address (unicast)
    Type: IP (0x0800)
    Padding: 000000000000
Internet Protocol Version 4, Src: 10.220.104.180 (10.220.104.180), Dst: 192.168.222.128 (192.168.222.128)
    Version: 4
    Header length: 20 bytes
    Differentiated Services Field: 0x00 (DSCP 0x00: Default; ECN: 0x00: Not-ECT (Not ECN-Capable Transport))
        0000 00.. = Differentiated Services Codepoint: Default (0x00)
        .... ..00 = Explicit Congestion Notification: Not-ECT (Not ECN-Capable Transport) (0x00)
    Total Length: 40
    Identification: 0x8323 (33571)
    Flags: 0x00
        0... .... = Reserved bit: Not set
        .0.. .... = Don't fragment: Not set
        ..0. .... = More fragments: Not set
    Fragment offset: 0
    Time to live: 128
    Protocol: TCP (6)
    Header checksum: 0xa4f3 [correct]
        [Good: True]
        [Bad: False]
    Source: 10.220.104.180 (10.220.104.180)
    Destination: 192.168.222.128 (192.168.222.128)
    [Source GeoIP: Unknown]
    [Destination GeoIP: Unknown]
Transmission Control Protocol, Src Port: EtherNet-IP-2 (44818), Dst Port: 44180 (44180), Seq: 29, Ack: 75, Len: 0
    Source port: EtherNet-IP-2 (44818)
    Destination port: 44180 (44180)
    [Stream index: 0]
    Sequence number: 29    (relative sequence number)
    Acknowledgment number: 75    (relative ack number)
    Header length: 20 bytes
    Flags: 0x010 (ACK)
        000. .... .... = Reserved: Not set
        ...0 .... .... = Nonce: Not set
        .... 0... .... = Congestion Window Reduced (CWR): Not set
        .... .0.. .... = ECN-Echo: Not set
        .... ..0. .... = Urgent: Not set
        .... ...1 .... = Acknowledgment: Set
        .... .... 0... = Push: Not set
        .... .... .0.. = Reset: Not set
        .... .... ..0. = Syn: Not set
        .... .... ...0 = Fin: Not set
    Window size value: 64240
    [Calculated window size: 64240]
    [Window size scaling factor: -2 (no window scaling used)]
    Checksum: 0x43a7 [validation disabled]
        [Good Checksum: False]
        [Bad Checksum: False]
    [SEQ/ACK analysis]
        [This is an ACK to the segment in frame: 8]
